{
  "id": "find-similar-photos",
  "title": "Find similar photos",
  "description": "Search a photo collection by visual similarity: turn every image into an embedding and compare them.",
  "steps": [
    {
      "label": "Embed every photo",
      "models": [
        "dinov2",
        "siglip",
        "resnet18"
      ]
    }
  ],
  "note": "Similarity search over the embeddings is a vector index, not a model. SigLIP also supports searching photos by text."
}
